scheme_code,scheme_service_name,scheme_status,scheme_confidential,scheme_type,scheme_registered_under_care_act,scheme_owning_organisation_name,scheme_support_services_provided_by,scheme_primary_client_group,scheme_has_other_client_group,scheme_secondary_client_group,scheme_support_type,scheme_intended_stay,scheme_created_at,scheme_active_dates
{id1},Updated test name,incomplete,No,Direct Access Hostel,No,Different organisation,Another registered stock owner,People with drug problems,No,Older people with support needs,Low level,Permanent,2022-04-01T00:00:00+01:00,"Active from 2 April 2020"
{id2},Test name,active,Yes,Housing for older people,Yes,MHCLG,The same organisation that owns the housing stock,People with alcohol problems,Yes,Older people with support needs,High level,Medium stay,2021-04-01T00:00:00+01:00,"Active from 1 April 2020"
{id3}, ,active,Yse,Direct access Hostel,Yes,non existing org,wrong answer,FD,no,lder people with support needs,high,Permanent ,2021-04-01T00:00:00+01:00,"Active from 1 April 2020"
Wrong_id,Incomplete scheme,incomplete,Yes,Housing for older people,No,MHCLG,The same organisation that owns the housing stock,People with alcohol problems,,,,,2021-04-01T00:00:00+01:00,"Active from 1 April 2020"
SWrong_id,Incomplete scheme,incomplete,Yes,Housing for older people,No,MHCLG,The same organisation that owns the housing stock,People with alcohol problems,,,,,2021-04-01T00:00:00+01:00,"Active from 1 April 2020"
